{
  "protocol": "AI Assurance Protocol",
  "protocol_version": "1.0.0",
  "kind": "passport.issue",
  "payload": {
    "passport_version": "1.0.0",
    "passport_id": "passport_example_001",
    "assurance_id": "assurance_example_001",
    "system": {
      "system_id": "agent_example",
      "version": "1.0.0",
      "environment": "production"
    },
    "assurance": {
      "verdict": "ASSURED",
      "metrics": {
        "reliability": 99.5
      },
      "policy_id": "policy_example",
      "evaluation_ids": [
        "evaluation_example_001"
      ],
      "evidence_ids": [
        "evidence_example_001"
      ],
      "reasons": [
        "All blocking policy rules passed."
      ]
    },
    "engine_version": "3.2.0",
    "created_at": "2026-09-15T00:00:00Z",
    "metadata": {},
    "integrity": {
      "algorithm": "SHA-256",
      "content_hash": "2b89477e240bdc88f94d8ff6ba8f42a86ebb85ae5c32862114ee5510a395832a"
    }
  },
  "integrity": {
    "algorithm": "SHA-256",
    "content_hash": "f309ddeb43c91ab847dedf94e6846fa9538434696a25ede6eac51b3f94920cfc"
  }
}
